{
  "experiment": "32-full-target-composition-audit",
  "status": "full_target_graph_audited",
  "source_sections": {
    "source_A": "NavierStokesR3.theorem_1_1_with_initial_rest",
    "source_B": "NavierStokesR3.ProblemStatement.breakdownStatement",
    "target": "NavierStokesR3.theorem_1_1_with_dissipation"
  },
  "frontier_scope": {
    "source_A_size": 2450,
    "source_B_size": 14,
    "target_size": 2522,
    "delta_A_to_target_size": 72,
    "delta_B_to_A_size": 2436,
    "delta_B_to_target_size": 2508,
    "nested": true,
    "disjoint_delta_partition": true
  },
  "delta_interface_audit": {
    "I72": {
      "interface_size": 12,
      "target_wide_coverage": 710,
      "delta_72_coverage": 72,
      "delta_72_uncovered": 0
    },
    "I2436": {
      "interface_size": 302,
      "target_wide_coverage": 2450,
      "delta_2436_coverage": 2436,
      "delta_2436_uncovered": 0
    },
    "I2508": {
      "interface_size": 309,
      "target_wide_coverage": 2522,
      "delta_2508_coverage": 2508,
      "delta_2508_uncovered": 0
    },
    "I2436_union_I72": {
      "interface_size": 314,
      "target_wide_coverage": 2522,
      "delta_2508_coverage": 2508,
      "delta_2508_uncovered": 0
    }
  },
  "full_target_optimization": {
    "candidate_graph": "target-section external edges",
    "target_frontier_size": 2522,
    "solver": "binary MILP",
    "status": "optimal",
    "minimum_cover_width": 309,
    "one_optimum_witness": [
      "NavierStokesR3.ActualCandidate.activatedVelocity_eventually_zero",
      "NavierStokesR3.ActualCandidate.compactForce_smooth",
      "NavierStokesR3.ActualCandidate.compactForce_supported_all_times",
      "NavierStokesR3.ActualCandidate.localized_pressure_tsupport",
      "NavierStokesR3.ActualCandidate.localized_residual_zero_early",
      "NavierStokesR3.ActualCandidate.localized_velocity_tsupport",
      "NavierStokesR3.ActualCandidate.of_localized_fields",
      "NavierStokesR3.ActualCandidate.selected_candidate_one_with_initial_rest",
      "NavierStokesR3.CompactComparisonBounds.exists_gradient_bound",
      "NavierStokesR3.CompactComparisonBounds.exists_radius_weight_derivative_zero",
      "NavierStokesR3.CompactComparisonBounds.lpNorm_three_eq_integral_norm_cube_rpow",
      "NavierStokesR3.CompactComparisonBounds.weight_fderiv_eq_zero_of_norm_lt",
      "NavierStokesR3.CompactEnergy.candidate_energy_dissipation_le",
      "NavierStokesR3.CompactEnergy.candidate_integrable_dissipation",
      "NavierStokesR3.CompactEnergy.candidate_total_dissipation_le",
      "NavierStokesR3.CompactEnergy.compact_inner_left",
      "NavierStokesR3.CompactEnergy.compact_inner_left._simp_1_1",
      "NavierStokesR3.CompactEnergy.compact_inner_left._simp_1_2",
      "NavierStokesR3.CompactEnergy.compact_partial",
      "NavierStokesR3.CompactEnergy.cumulativeForceNorm_continuous",
      "NavierStokesR3.CompactEnergy.cumulativeForceNorm_hasDerivAt",
      "NavierStokesR3.CompactEnergy.energy_balance",
      "NavierStokesR3.CompactEnergy.energy_balance_viscosity",
      "NavierStokesR3.CompactEnergy.energy_balance_viscosity._abel_1_1",
      "NavierStokesR3.CompactEnergy.energy_hasDerivAt",
      "NavierStokesR3.CompactEnergy.forceWork_continuousOn",
      "NavierStokesR3.CompactEnergy.force_work_le",
      "NavierStokesR3.CompactEnergy.integral_fderiv_apply",
      "NavierStokesR3.CompactEnergy.integral_inner_partial",
      "NavierStokesR3.CompactEnergy.integral_l2Norm_cumulative_eq_sq",
      "NavierStokesR3.CompactEnergy.integral_partial_eq_zero",
      "NavierStokesR3.CompactEnergy.l2Sq_continuous",
      "NavierStokesR3.CompactEnergy.spatialPartial_continuousOn_slab",
      "NavierStokesR3.CompactEnergy.work_le_sqrt_l2Sq",
      "NavierStokesR3.CompactForceBound.exists_uniform_l2sq_bound",
      "NavierStokesR3.CompactSchwartz.ofCompactSupport",
      "NavierStokesR3.CompactSchwartz.weighted_derivative_bound",
      "NavierStokesR3.CompactTimeIntegral.continuousOn_timeFDeriv_of_contDiffOn",
      "NavierStokesR3.CompactTimeIntegral.continuous_slice",
      "NavierStokesR3.CompactTimeIntegral.hasDerivAt_integral",
      "NavierStokesR3.CompactTimeIntegral.hasDerivAt_integral_of_contDiffOn",
      "NavierStokesR3.CompactTimeIntegral.hasDerivAt_integral_of_contDiffOn_of_hasDerivAt",
      "NavierStokesR3.CompactTimeIntegral.hasDerivAt_time_of_contDiffOn",
      "NavierStokesR3.Comparison.abs_sq_sub_sq_le_one",
      "NavierStokesR3.Comparison.abs_sq_sub_sq_le_two_mul_abs_sub",
      "NavierStokesR3.Comparison.absoluteCancelledTimeKernel_le",
      "NavierStokesR3.Comparison.aestronglyMeasurable_slab",
      "NavierStokesR3.Comparison.cancelledComplexTimeIntegrand_measurable",
      "NavierStokesR3.Comparison.cancelledTimeIntegrand_measurable",
      "NavierStokesR3.Comparison.cancelledTimeKernel_abs_le",
      "NavierStokesR3.Comparison.cancelledTimeKernel_integrable_time",
      "NavierStokesR3.Comparison.cancelledTimeKernel_measurable",
      "NavierStokesR3.Comparison.cancelledTimeKernel_product_integrable",
      "NavierStokesR3.Comparison.continuousOn_time_weight",
      "NavierStokesR3.Comparison.continuous_slice_of_continuousOn",
      "NavierStokesR3.Comparison.cutoffSquareDifference_abs_le_scaled_min",
      "NavierStokesR3.Comparison.fourierIntegralInv_mul_fourier",
      "NavierStokesR3.Comparison.heatKernelSecond_integral_norm_le",
      "NavierStokesR3.Comparison.heatKernelSecond_inverseTime_decomposition",
      "NavierStokesR3.Comparison.heatKernelSecond_joint_measurable",
      "NavierStokesR3.Comparison.heatKernelTimeConstant_pos",
      "NavierStokesR3.Comparison.heatKernel_nonneg",
      "NavierStokesR3.Comparison.heatSecondTest_eq_convolution",
      "NavierStokesR3.Comparison.integrableOn_inverseTimeGamma",
      "NavierStokesR3.Comparison.integrable_heatSecondSymbol_space",
      "NavierStokesR3.Comparison.integral_heatKernelSecondTimeEnvelope",
      "NavierStokesR3.Comparison.integral_heatSecondSymbol",
      "NavierStokesR3.Comparison.integral_inverseTimeGamma",
      "NavierStokesR3.Comparison.integral_inverseTimeGamma_square_scale",
      "NavierStokesR3.Comparison.memLp_two_timeIntegral",
      "NavierStokesR3.Comparison.norm_heatKernelSecond_le",
      "NavierStokesR3.Comparison.norm_integral_sq_le_measure_mul_integral_sq",
      "NavierStokesR3.Comparison.norm_sub_sq_le_twice",
      "NavierStokesR3.Comparison.radialCommutatorKernel_lpNorm_scale",
      "NavierStokesR3.Comparison.radialCommutatorKernel_measurable",
      "NavierStokesR3.Comparison.radialCommutatorKernel_memLp",
      "NavierStokesR3.Comparison.radialCommutatorKernel_nonneg",
      "NavierStokesR3.Comparison.radialCommutatorKernel_power_integrable",
      "NavierStokesR3.Comparison.rieszTest_eq_integral_heatSecondTest",
      "NavierStokesR3.Comparison.riesz_commutator_eq_heatKernel",
      "NavierStokesR3.Comparison.squareIntegrableAtTime_iff_memLp",
      "NavierStokesR3.Comparison.squareIntegrableAtTime_sub",
      "NavierStokesR3.Comparison.timeAverage_complex_pairing_of_bounded",
      "NavierStokesR3.Comparison.timeAverage_complex_pairing_of_memLp_two",
      "NavierStokesR3.Comparison.timeAverage_integrand_integrable",
      "NavierStokesR3.Comparison.uniformFiniteEnergy_component_l2Sq_bound",
      "NavierStokesR3.ComparisonCutoffs.baseBump",
      "NavierStokesR3.ComparisonCutoffs.baseCutoff._proof_1",
      "NavierStokesR3.ComparisonCutoffs.baseCutoff_eq_one",
      "NavierStokesR3.ComparisonCutoffs.baseCutoff_eq_zero",
      "NavierStokesR3.ComparisonCutoffs.baseCutoff_le_one",
      "NavierStokesR3.ComparisonCutoffs.baseCutoff_smooth",
      "NavierStokesR3.ComparisonCutoffs.cutoff_iteratedFDeriv_le",
      "NavierStokesR3.ComparisonCutoffs.cutoff_smooth",
      "NavierStokesR3.ComparisonCutoffs.cutoff_support_subset",
      "NavierStokesR3.ComparisonCutoffs.cutoff_tsupport_subset",
      "NavierStokesR3.ComparisonCutoffs.derivativeConstant_pos",
      "NavierStokesR3.ComparisonCutoffs.eventually_cutoff_eq_one",
      "NavierStokesR3.ComparisonCutoffs.norm_partial_partial_le",
      "NavierStokesR3.ComparisonCutoffs.norm_scaled",
      "NavierStokesR3.ComparisonGronwall.exp_neg_mul_le_of_deriv_le",
      "NavierStokesR3.ComparisonRateBound.exists_uniform_flux_absorption",
      "NavierStokesR3.ComparisonRateBound.exists_uniform_rate_bound",
      "NavierStokesR3.ComparisonYoung.cutoff_expression_le",
      "NavierStokesR3.ComparisonYoung.exists_rpow_absorption",
      "NavierStokesR3.ConservativeDifference.compact_scalarLaplacian",
      "NavierStokesR3.ConservativeDifference.component_test_hasDerivAt",
      "NavierStokesR3.ConservativeDifference.conservative_difference_equation",
      "NavierStokesR3.ConservativeDifference.integral_scalarLaplacian_mul",
      "NavierStokesR3.ConservativeDifference.integral_time_derivative_divergence_free",
      "NavierStokesR3.ConservativeDifference.partial_comm",
      "NavierStokesR3.ConservativeDifference.partial_mul",
      "NavierStokesR3.ConservativeDifference.partial_partial_eq_fderiv",
      "NavierStokesR3.ConservativeDifference.partial_sub",
      "NavierStokesR3.ConservativeDifference.partial_sum",
      "NavierStokesR3.ConservativeDifference.pressureGradient_component",
      "NavierStokesR3.ConservativeDifference.weak_pressure_gradient",
      "NavierStokesR3.ConservativeDifference.weak_pressure_poisson",
      "NavierStokesR3.FourierSobolevWeights.BCLM",
      "NavierStokesR3.FourierSobolevWeights.BCLM._proof_11",
      "NavierStokesR3.FourierSobolevWeights.BCLM._proof_12",
      "NavierStokesR3.FourierSobolevWeights.BCLM._proof_13",
      "NavierStokesR3.FourierSobolevWeights.BCLM._proof_14",
      "NavierStokesR3.FourierSobolevWeights.BCLM._proof_15",
      "NavierStokesR3.FourierSobolevWeights.BCLM._proof_16",
      "NavierStokesR3.FourierSobolevWeights.BCLM._proof_17",
      "NavierStokesR3.FourierSobolevWeights.BCLM._proof_3",
      "NavierStokesR3.FourierSobolevWeights.BCLM._proof_5",